{
  "$schema": "https://wuzzkang.com/schemas/page-document.schema.json",
  "$version": "1.0.0",
  "id": "11111111-1111-1111-1111-111111111111",
  "createdAt": "2026-07-27T10:00:00Z",
  "updatedAt": "2026-07-27T10:00:00Z",
  "meta": {
    "title": "Minimal Landing Page",
    "description": "Minimal test page document for WuzzKang V2",
    "slug": "minimal-test-page",
    "lang": "id",
    "status": "draft"
  },
  "designSystemId": "default-light",
  "nodes": [
    {
      "id": "a1b2c3d4-e5f6-7a8b-9c0d-1e2f3a4b5c6d",
      "typeId": "hero-basic",
      "order": 0,
      "parentId": null,
      "data": {
        "headline": {
          "$type": "text",
          "value": "Selamat Datang di WuzzKang V2"
        },
        "subheadline": {
          "$type": "text",
          "value": "Platform visual builder berbasis komponen modular."
        },
        "ctaLabel": {
          "$type": "text",
          "value": "Mulai Sekarang"
        },
        "ctaUrl": {
          "$type": "url",
          "href": "https://wuzzkang.com/register",
          "openInNewTab": false
        }
      },
      "styleOverrides": {},
      "visibility": {
        "desktop": true,
        "tablet": true,
        "mobile": true
      },
      "locked": false,
      "label": "Hero Section"
    }
  ],
  "formatVersion": 1,
  "checksum": "e3b0c44298fc1c149afbf4c8996fb92427ae41e4649b934ca495991b7852b855"
}
