{
  "$schema": "https://wuzzkang.com/schemas/page-document.schema.json",
  "$version": "1.0.0",
  "id": "44444444-4444-4444-4444-444444444444",
  "createdAt": "2026-07-27T10:45:00Z",
  "updatedAt": "2026-07-27T10:45:00Z",
  "meta": {
    "title": "Dark Mode Cyberpunk Landing",
    "description": "Test page with dark mode theme overrides",
    "slug": "darkmode-test",
    "lang": "id",
    "status": "draft"
  },
  "designSystemId": "cyberpunk-dark",
  "nodes": [
    {
      "id": "e5f6a7b8-c90d-1e2f-3a4b-5c6d7e8f9a0b",
      "typeId": "hero-basic",
      "order": 0,
      "parentId": null,
      "data": {
        "headline": {
          "$type": "text",
          "value": "Next Generation Builder"
        },
        "backgroundOverlay": {
          "$type": "boolean",
          "value": true
        }
      },
      "styleOverrides": {
        "backgroundColor": {
          "$token": "semantic.color.background.primary",
          "fallback": "#05050A"
        }
      },
      "visibility": {
        "desktop": true,
        "tablet": true,
        "mobile": true
      },
      "locked": false,
      "label": "Dark Hero"
    }
  ],
  "formatVersion": 1,
  "checksum": "b6e0c44298fc1c149afbf4c8996fb92427ae41e4649b934ca495991b7852b888"
}
